{
  "version": 1,
  "title": "Notebook app, round 3: behaviour",
  "tab": "Behaviour",
  "intro": "Independent of round 2, so it is open at the same time. The first item is a live mockup.",
  "notice": "Synthetic data only: the app, the screens and the numbers are made up.",
  "lang": "en",
  "items": [
    {
      "id": "settings-live",
      "group": "Behaviour",
      "title": "Does the two-column settings page work at every width?",
      "description": "A live mockup: switch the theme and the width above it, and click the toggles.",
      "cost": "The layout from round 1; about 60 lines of CSS.",
      "images": [
        {
          "html": "boards/settings.html",
          "caption": "Settings, two columns from 760 px"
        }
      ],
      "options": [
        {
          "id": "ship",
          "label": "Ship it like this"
        },
        {
          "id": "tweak",
          "label": "Needs changes",
          "detail": "say what in the comment"
        }
      ],
      "recommended": "ship"
    },
    {
      "id": "theme",
      "group": "Behaviour",
      "title": "Default theme",
      "description": "What a new install shows before anyone touches the setting.",
      "options": [
        {
          "id": "system",
          "label": "Follow the system"
        },
        {
          "id": "light",
          "label": "Always light"
        },
        {
          "id": "dark",
          "label": "Always dark"
        }
      ],
      "recommended": "system",
      "comment": false,
      "other": true
    },
    {
      "id": "export",
      "group": "Behaviour",
      "title": "Export formats",
      "description": "Formats offered in the Export menu.",
      "cost": "Markdown is free; PDF adds a print stylesheet; HTML adds a template.",
      "select": "many",
      "options": [
        {
          "id": "md",
          "label": "Markdown"
        },
        {
          "id": "pdf",
          "label": "PDF"
        },
        {
          "id": "html",
          "label": "HTML"
        }
      ],
      "recommended": [
        "md",
        "pdf"
      ],
      "skippable": true
    }
  ],
  "free_text": {
    "title": "Anything else",
    "placeholder": "Anything the list does not ask about"
  }
}
